{
  "schema": "bankingops-coverage-grid.release-manifest.v1",
  "release": {
    "repository": "thefazzer/bankingops-coverage-grid",
    "tag": "v0.6.3",
    "commit_sha": "fd846e4e1dbe47401b4749fc5c52f30fd61b5020",
    "generated_at": "2026-10-17T02:46:51.688748Z"
  },
  "semantic_profile": {
    "id": "bocg-common-semantics",
    "version": "0.4.0",
    "path": "specs/common-semantic-profile.yaml",
    "sha256": "459dc8feb1c4d979c047cfd59afbc197d368ab045db5a4ceaaec77146cbe2732"
  },
  "artifacts": [
    {
      "path": "CONFORMANCE.md",
      "role": "conformance-record",
      "media_type": "text/markdown",
      "size_bytes": 5297,
      "sha256": "11a27134237f5fe37a77f0634cde55593139cfc469780117634d1bd756e2f974"
    },
    {
      "path": "cells/cp_aana_umr_scope.json",
      "role": "control-point-cell",
      "media_type": "application/json",
      "size_bytes": 1920,
      "sha256": "2170fcdbb608d19f2d55569dbb24e7d613a829033aa94dfe009c34fffb787c52"
    },
    {
      "path": "cells/cp_cftc_part43_realtime.json",
      "role": "control-point-cell",
      "media_type": "application/json",
      "size_bytes": 1675,
      "sha256": "fdca7ee893e2baa1cc6db37999bd3e0685d90e4a8e837882b33d82608caed9ce"
    },
    {
      "path": "cells/cp_credit_event_determination_committee_application.json",
      "role": "control-point-cell",
      "media_type": "application/json",
      "size_bytes": 1868,
      "sha256": "7140d03ed61af259ec4c5942c79d946334c2367e919b4cedd4293f9efa0f00bd"
    },
    {
      "path": "cells/cp_csa_vm_call_timeline.json",
      "role": "control-point-cell",
      "media_type": "application/json",
      "size_bytes": 1852,
      "sha256": "8c0bcfb98a2e5a50bdfdfbba0b066a55cc43872abd13dfd65d7f733551880c2d"
    },
    {
      "path": "cells/cp_dc_outcome_application.json",
      "role": "control-point-cell",
      "media_type": "application/json",
      "size_bytes": 2086,
      "sha256": "0c541cb8abfb6fe666980a3e759a8b762c9af4a05d11c53a7b062caea0e4e126"
    },
    {
      "path": "cells/cp_derivatives_documentation_execution.json",
      "role": "control-point-cell",
      "media_type": "application/json",
      "size_bytes": 2066,
      "sha256": "694212565612ecd8bb4ddaa4889fe48af682c49a196947f8aaf177c5dd88e20a"
    },
    {
      "path": "cells/cp_derivatives_transaction_reporting_uti_upi.json",
      "role": "control-point-cell",
      "media_type": "application/json",
      "size_bytes": 2168,
      "sha256": "83820c649aa57202a39b8aafed28f8edcbeabbc538d52e7c33f18ea7be6d1023"
    },
    {
      "path": "cells/cp_emir_refit_uti_pairing.json",
      "role": "control-point-cell",
      "media_type": "application/json",
      "size_bytes": 1945,
      "sha256": "1dac1f0a799548bce32a459c3a0bd5daf3d0513b4c400c2a2adb2dc0fe0414e6"
    },
    {
      "path": "cells/cp_mifir_art26_t1_submission.json",
      "role": "control-point-cell",
      "media_type": "application/json",
      "size_bytes": 1744,
      "sha256": "1f1207876a0564d49c0e027690c5f5cff3679780b4ce125f9f1f0dcb755857b7"
    },
    {
      "path": "cells/cp_otc_confirmation_timeliness.json",
      "role": "control-point-cell",
      "media_type": "application/json",
      "size_bytes": 1847,
      "sha256": "14106025dd3c125ad485463977a09939057c516c3d2a69263854c025be31d96b"
    },
    {
      "path": "cells/cp_otc_derivatives_confirmation_reconciliation.json",
      "role": "control-point-cell",
      "media_type": "application/json",
      "size_bytes": 1932,
      "sha256": "4f731c398efb6cd44cbaef6b0ee4756a5252e0de2c29de49956bc314747a8acf"
    },
    {
      "path": "cells/cp_portfolio_reconciliation.json",
      "role": "control-point-cell",
      "media_type": "application/json",
      "size_bytes": 1882,
      "sha256": "409304c6ad19fcfb265d3bcafef9d004a14d14046352fc45c50f043923af364e"
    },
    {
      "path": "cells/cp_reporting_error_remediation.json",
      "role": "control-point-cell",
      "media_type": "application/json",
      "size_bytes": 2037,
      "sha256": "76e04d40e6f060cb688473f8b6570fd03176097d89944572612151a3bf8555ed"
    },
    {
      "path": "cells/cp_settled_instruction_amendment.json",
      "role": "control-point-cell",
      "media_type": "application/json",
      "size_bytes": 1506,
      "sha256": "92d0886e8b1b3619ac845dafc93e439e8e19d16e2787d35ffacdee6f201d8e53"
    },
    {
      "path": "cells/cp_simm_im_dispute.json",
      "role": "control-point-cell",
      "media_type": "application/json",
      "size_bytes": 1982,
      "sha256": "4642b22683626143d81fce39c8efbb65d171c7a1852215c1654485155bcdc264"
    },
    {
      "path": "cells/cp_simm_initial_margin_reconciliation.json",
      "role": "control-point-cell",
      "media_type": "application/json",
      "size_bytes": 1893,
      "sha256": "741e3460dbe01a8c7c4d78cb4c61fcedf30aa90e3a90eabb51d70570371a9bd2"
    },
    {
      "path": "cells/cp_umr_im_segregation.json",
      "role": "control-point-cell",
      "media_type": "application/json",
      "size_bytes": 1910,
      "sha256": "e273d3fa7ff8fbe2587a35e15c618f4889a3afb65f3ea383658d1526aac56a12"
    },
    {
      "path": "docs/isda-overlap.md",
      "role": "documentation",
      "media_type": "text/markdown",
      "size_bytes": 10535,
      "sha256": "de7c38fecf93bc84dbcd1cd853b086a59a752da1cbef51131406a3e29739d7af"
    },
    {
      "path": "live-run-20260826/RUN_SUMMARY.json",
      "role": "run-summary",
      "media_type": "application/json",
      "size_bytes": 1671,
      "sha256": "b5e1eabce644a35387adf132950285593dab4adf465655237fce20f7ab4799d4"
    },
    {
      "path": "live-run-20260826/aliases.yaml",
      "role": "normalisation-aliases",
      "media_type": "application/yaml",
      "size_bytes": 23232,
      "sha256": "61025b9f408f81149bf17da747fde25b8ab3175651c186825051e191f6c0d668"
    },
    {
      "path": "live-run-20260826/exclusions.json",
      "role": "exclusion-ledger",
      "media_type": "application/json",
      "size_bytes": 1635,
      "sha256": "28b0c86622fd93277ffd0882585956d7792446918dabb5c4d8432b0d904ba4d8"
    },
    {
      "path": "live-run-20260826/gates_report.json",
      "role": "gate-report",
      "media_type": "application/json",
      "size_bytes": 6045,
      "sha256": "600d3ffdde07faad9a1542f08bd0092fc5ebe98e6e5ab42da33e1cd8b254baf1"
    },
    {
      "path": "live-run-20260826/matrix.json",
      "role": "coverage-matrix",
      "media_type": "application/json",
      "size_bytes": 925734,
      "sha256": "6825d4c51428e7f0ebfac0c6b75bf237b3a6f09766071a50f468cfa0d800538d"
    },
    {
      "path": "live-run-20260826/normalised.json",
      "role": "normalised-grid",
      "media_type": "application/json",
      "size_bytes": 1049535,
      "sha256": "36c5ab2551dfc67c2ef462db29c2ef70f6d6dc32fdab2b16feba4dc5c9888155"
    },
    {
      "path": "reference/cleanroom-eval-companion.v1.json",
      "role": "cleanroom-eval-companion-pin",
      "media_type": "application/json",
      "size_bytes": 606,
      "sha256": "7da814d94e389f9f7511694d7c4a7c2e420efc112acbad032c992c0052aae4ed"
    },
    {
      "path": "reference/operating-catalogue.v1.json",
      "role": "operating-reference-catalogue",
      "media_type": "application/json",
      "size_bytes": 641217,
      "sha256": "fc8617e5ac3db5957a49b3e8bdbd42c3fa864ff4cde95081d5de93565178b5ad"
    },
    {
      "path": "reference/public-eval-inventory.v1.yaml",
      "role": "public-eval-inventory",
      "media_type": "application/yaml",
      "size_bytes": 3547,
      "sha256": "d88223dce15e5c734eeff6bfcef76dd8956ef3371c2505cbb80f7619dc4f4008"
    },
    {
      "path": "reference/public-eval-llmaj-ledger.v1.json",
      "role": "public-eval-llmaj-ledger",
      "media_type": "application/json",
      "size_bytes": 22434,
      "sha256": "09255359fb1bedccf4e008b546d16ded7ab490812541d300f91b33add872a1d7"
    },
    {
      "path": "reference/public-eval-llmaj-prereg.v1.json",
      "role": "public-eval-llmaj-prereg",
      "media_type": "application/json",
      "size_bytes": 2757,
      "sha256": "f29b634dc72d99d4f2cd1b865abb3982aaf6afb05f4d256a249bcfa09c0fcac1"
    },
    {
      "path": "reference/public-eval-observatory.v1.json",
      "role": "public-eval-observatory",
      "media_type": "application/json",
      "size_bytes": 7184,
      "sha256": "1cfa01ec3dd3f261dcf5d258eec2cc86176e10402da0e530c15e140b0d3a758d"
    },
    {
      "path": "reference/public-eval-surface-map.v1.json",
      "role": "public-eval-surface-overlay",
      "media_type": "application/json",
      "size_bytes": 14644,
      "sha256": "004ec6b3d367b985fa009473c1e7bc645aedaa351aa15819255f16d2308efadf"
    },
    {
      "path": "reference/task-concept-rulings.yaml",
      "role": "task-concept-rulings",
      "media_type": "application/yaml",
      "size_bytes": 8834,
      "sha256": "c0b544ab55112cbd98092e7d5af50d5ddccda0c10178dc99c314afe6880e4cf5"
    },
    {
      "path": "reference/task-concepts.v1.json",
      "role": "task-concept-catalogue",
      "media_type": "application/json",
      "size_bytes": 638828,
      "sha256": "8f154d0dfe6116bff4da9e25d29b1d986b22da99e7a56e2bf6e9edc32a7b622d"
    },
    {
      "path": "specs/SPEC-01-coverage-grid-elicitation.md",
      "role": "normative-specification",
      "media_type": "text/markdown",
      "size_bytes": 17718,
      "sha256": "a1810a19cbbf8b822207a2f9160b6b548ac67c3a3bcafcccc1d75d098954eb08"
    },
    {
      "path": "specs/SPEC-03-control-point-cells.md",
      "role": "normative-specification",
      "media_type": "text/markdown",
      "size_bytes": 3519,
      "sha256": "89fd3a215418a8639c854356bd084554f22a1b57c3f8c7b2a264ce9dc54876cf"
    },
    {
      "path": "specs/SPEC-04-common-semantic-profile.md",
      "role": "normative-specification",
      "media_type": "text/markdown",
      "size_bytes": 5638,
      "sha256": "bbe449d49607f5feb99aa068e73fbe6d56e43c385354f576589811c5316973d7"
    },
    {